{
    "worlds": {
        "Temple Grounds": {
            "areas": {
                "Dynamo Chamber": {
                    "elevators": [],
                    "docks": {
                        "North": {
                            "old_door_type": "Normal",
                            "new_door_type": "PowerBomb"
                        }
                    },
                    "layers": {
                        "1st Pass Scripting": false,
                        "2nd Pass Scripting": true
                    },
                    "low_memory_mode": false
                },
                "Trooper Security Station": {
                    "elevators": [],
                    "docks": {},
                    "layers": {
                        "1st Pass": false,
                        "2nd Pass": true
                    }
                },
                "Landing Site": {
                    "elevators": [],
                    "docks": {
                        "North": {
                            "old_door_type": "Normal",
                            "new_door_type": "SeekerMissile"
                        }
                    },
                    "layers": {},
                    "low_memory_mode": false
                },
                "Service Access": {
                    "elevators": [],
                    "docks": {
                        "South": {
                            "old_door_type": "Normal",
                            "new_door_type": "SeekerMissile"
                        },
                        "East": {
                            "old_door_type": "Normal",
                            "new_door_type": "Dark"
                        },
                        "West": {
                            "old_door_type": "SuperMissile",
                            "new_door_type": "PowerBomb"
                        }
                    },
                    "layers": {},
                    "low_memory_mode": false
                },
                "Path of Honor": {
                    "elevators": [],
                    "docks": {
                        "West": {
                            "old_door_type": "Normal",
                            "new_door_type": "Dark"
                        },
                        "North": {
                            "old_door_type": "SeekerMissile",
                            "new_door_type": "Normal"
                        }
                    },
                    "layers": {},
                    "low_memory_mode": false
                },
                "Meeting Grounds": {
                    "elevators": [],
                    "docks": {
                        "North": {
                            "old_door_type": "Normal",
                            "new_door_type": "SeekerMissile"
                        },
                        "EastBottom": {
                            "old_door_type": "SuperMissile",
                            "new_door_type": "PowerBomb"
                        }
                    },
                    "layers": {},
                    "low_memory_mode": false
                },
                "Hive Transport Area": {
                    "elevators": [],
                    "docks": {
                        "group35_blue_01_Temple_Hive_1_4_East_BigDoor": {
                            "old_door_type": "Normal",
                            "new_door_type": "PowerBomb"
                        }
                    },
                    "layers": {},
                    "low_memory_mode": false
                },
                "Hall of Honored Dead": {
                    "elevators": [],
                    "docks": {
                        "South": {
                            "old_door_type": "SeekerMissile",
                            "new_door_type": "Normal"
                        }
                    },
                    "layers": {},
                    "low_memory_mode": false
                },
                "Hall of Eyes": {
                    "elevators": [],
                    "docks": {
                        "West": {
                            "old_door_type": "SuperMissile",
                            "new_door_type": "Normal"
                        },
                        "South": {
                            "old_door_type": "Normal",
                            "new_door_type": "SeekerMissile"
                        }
                    },
                    "layers": {},
                    "low_memory_mode": false
                },
                "Hive Chamber C": {
                    "elevators": [],
                    "docks": {
                        "North1": {
                            "old_door_type": "Normal",
                            "new_door_type": "Normal"
                        },
                        "blue_01_Temple_Hive_1_4_West_BigDoor": {
                            "old_door_type": "Normal",
                            "new_door_type": "PowerBomb"
                        }
                    },
                    "layers": {},
                    "low_memory_mode": false
                },
                "Hive Tunnel": {
                    "elevators": [],
                    "docks": {
                        "East1": {
                            "old_door_type": "Normal",
                            "new_door_type": "PowerBomb"
                        }
                    },
                    "layers": {},
                    "low_memory_mode": false
                },
                "Base Access": {
                    "elevators": [],
                    "docks": {
                        "South": {
                            "old_door_type": "SuperMissile",
                            "new_door_type": "Normal"
                        }
                    },
                    "layers": {},
                    "low_memory_mode": false
                },
                "Path of Eyes": {
                    "elevators": [],
                    "docks": {
                        "North": {
                            "old_door_type": "SuperMissile",
                            "new_door_type": "PowerBomb"
                        },
                        "East": {
                            "old_door_type": "SuperMissile",
                            "new_door_type": "Normal"
                        }
                    },
                    "layers": {},
                    "low_memory_mode": false
                },
                "Hive Chamber B": {
                    "elevators": [],
                    "docks": {
                        "South": {
                            "old_door_type": "Normal",
                            "new_door_type": "Missile"
                        }
                    },
                    "layers": {},
                    "low_memory_mode": false
                },
                "Hive Save Station": {
                    "elevators": [],
                    "docks": {
                        "South": {
                            "old_door_type": "Normal",
                            "new_door_type": "Normal"
                        }
                    },
                    "layers": {},
                    "low_memory_mode": false
                },
                "Command Chamber": {
                    "elevators": [],
                    "docks": {
                        "East": {
                            "old_door_type": "Normal",
                            "new_door_type": "PowerBomb"
                        },
                        "West2": {
                            "old_door_type": "Normal",
                            "new_door_type": "PowerBomb"
                        }
                    },
                    "layers": {},
                    "low_memory_mode": false
                },
                "War Ritual Grounds": {
                    "elevators": [],
                    "docks": {
                        "EastBottom": {
                            "old_door_type": "Normal",
                            "new_door_type": "SeekerMissile"
                        },
                        "North": {
                            "old_door_type": "SuperMissile",
                            "new_door_type": "Normal"
                        }
                    },
                    "layers": {},
                    "low_memory_mode": false
                },
                "Windchamber Gateway": {
                    "elevators": [],
                    "docks": {
                        "South": {
                            "old_door_type": "SuperMissile",
                            "new_door_type": "PowerBomb"
                        },
                        "East": {
                            "old_door_type": "PowerBomb",
                            "new_door_type": "Missile"
                        }
                    },
                    "layers": {},
                    "low_memory_mode": false
                },
                "Torvus Transport Access": {
                    "elevators": [],
                    "docks": {
                        "South": {
                            "old_door_type": "Missile",
                            "new_door_type": "Sunburst"
                        }
                    },
                    "layers": {},
                    "low_memory_mode": false
                },
                "Temple Assembly Site": {
                    "elevators": [],
                    "docks": {
                        "South1": {
                            "old_door_type": "Missile",
                            "new_door_type": "PowerBomb"
                        },
                        "West": {
                            "old_door_type": "Normal",
                            "new_door_type": "Missile"
                        }
                    },